Topic,Question
"Science","Who invented the World Wide Web?"
"Science","Which British inventor created the steam engine that helped power the Industrial Revolution?"
"Science","Who invented the first practical telephone and was born in Scotland?"
"Science","What did Edward Jenner invent in the 1790s that saved millions of lives?"
"Science","Which British scientist invented the television?"
"Science","Who invented the jet engine in the UK?"
"Science","What medical imaging invention is Sir Godfrey Hounsfield known for?"
"Science","What is the Bubble Test?"
"Science","Who invented the space-grade 3D printer?"
